{
  "schema_version": 1,
  "destination_id": "S11-ARTICLE-PRESSURE",
  "service_id": "S11",
  "slug": "sistemy-tumanoobrazovanija-vysokogo-i-nizkogo-davlenija",
  "canonical": "https://exp76.ru/sistemy-tumanoobrazovanija-vysokogo-i-nizkogo-davlenija/",
  "post_title": "Туманообразование высокого и низкого давления: в чём разница",
  "post_excerpt": "Сравниваем системы туманообразования высокого и низкого давления: характер распыления, требования к воде, сценарии применения, обслуживание и ограничения.",
  "post_content": "Давление — только один из параметров туманообразования. Качество результата зависит от всей системы: форсунок, воды, фильтрации, зонирования, погоды и обслуживания.",
  "featured_image_url": "https://exp76.ru/wp-content/uploads/2017/01/tuman1.webp",
  "acf": {
    "blogseo_hero_title": "Туманообразование высокого и низкого давления: в чём разница",
    "blogseo_hero_subtitle": "Как давление связано с характером распыления, почему нельзя выбирать систему по одному числу и какие исходные данные нужны для террасы, кафе или теплицы.",
    "blogseo_lead": "Названия «высокое» и «низкое давление» описывают класс системы, но сами по себе не гарантируют охлаждение, отсутствие капель или подходящий микроклимат. Результат формируют насос, форсунки, вода, расположение линий, погода и режим управления. Сравнивать нужно не отдельный компонент, а полный рабочий контур и его соответствие конкретной площадке.",
    "blogseo_main_image_url": "https://exp76.ru/wp-content/uploads/2017/01/tuman1.webp",
    "blogseo_main_image_alt": "Форсунки системы туманообразования на открытой площадке",
    "blogseo_sections": [
      {
        "heading": "Что означает давление в системе туманообразования",
        "body": "<p>Вода подаётся к форсункам, которые формируют распыление. Рабочее давление влияет на этот процесс, но связано с конструкцией форсунок и всего оборудования. Одинаковое слово «высокое» у разных производителей нельзя превращать в универсальную техническую границу без документации конкретной системы.</p>\n\n<p>При сравнении смотрят диапазон, для которого рассчитаны насос, трубопроводы, соединения и форсунки. Нельзя произвольно повысить давление в контуре низкого класса или заменить один элемент на «более мощный»: совместимость и допустимые режимы подтверждает производитель или проектное решение.</p>",
        "points": [
          {
            "title": "Давление — не отдельная настройка",
            "text": "Оно связано с насосом, форсунками, линиями и управляющими элементами единой системы."
          },
          {
            "title": "Класс не равен результату",
            "text": "Само название не обещает заданную температуру, влажность или отсутствие увлажнения поверхностей."
          },
          {
            "title": "Сравнивают комплект",
            "text": "Оценивают совместимые компоненты, документацию и режим для конкретной зоны."
          }
        ]
      },
      {
        "heading": "Как обычно различается характер распыления",
        "body": "<p>Системы более высокого рабочего давления обычно выбирают, когда требуется сформировать более мелкое распыление и увеличить вероятность испарения воды до контакта с поверхностями. Но фактическое поведение зависит от форсунок, влажности, температуры, ветра, высоты и направления монтажа.</p>\n\n<p>Низкое давление может быть уместно для задач, где допустима более выраженная капля или локальное увлажнение, а требования к ощущению сухой зоны ниже. На открытой площадке такая система не становится автоматически плохой или хорошей: нужно проверить, куда попадает распыление и соответствует ли это сценарию.</p>",
        "points": [
          {
            "title": "Более высокое давление",
            "text": "Рассматривают для мелкого распыления в составе рассчитанного комплекта, учитывая погоду и монтаж."
          },
          {
            "title": "Более низкое давление",
            "text": "Может давать более заметное увлажнение и требует особенно внимательной проверки поверхностей и назначения зоны."
          },
          {
            "title": "Фактический тест",
            "text": "Окончательную настройку делают на площадке, наблюдая границы факела и влияние ветра."
          }
        ]
      },
      {
        "heading": "Почему нельзя обещать фиксированное охлаждение",
        "body": "<p>Испарение воды связано с состоянием воздуха. В жаркую сухую погоду один и тот же контур ведёт себя иначе, чем при высокой влажности или порывистом ветре. Открытая терраса, закрытая веранда и теплица имеют разные воздухообмен и ограничения, поэтому рекламная цифра снижения температуры без условий не описывает будущий объект.</p>\n\n<p>Правильнее задавать измеримые требования к зоне: какие места обслуживаются, допустимо ли попадание влаги на покрытия и мебель, как меняется режим при ветре, кто управляет системой и где проходит граница отключения. После запуска наблюдают фактическое распыление и корректируют режим в пределах допустимого оборудования.</p>",
        "points": []
      },
      {
        "heading": "Вода и фильтрация важны при любом давлении",
        "body": "<p>Мелкие проходы форсунок чувствительны к загрязнениям, а состав воды может влиять на отложения и следы на окружающих поверхностях. Поэтому перед подбором оборудования выясняют источник воды и требования производителя к подготовке, фильтрации и обслуживанию.</p>\n\n<p>Нельзя назначить одинаковый фильтр для всех объектов только по внешнему виду воды. Состав подготовки связывают с анализом доступных данных, расходом, режимом и конкретным комплектом. Регламент обслуживания должен включать доступ к фильтрам, контроль форсунок и безопасную консервацию, а не только кнопку включения.</p>",
        "points": [
          {
            "title": "Исходная вода",
            "text": "Нужно знать источник и доступные сведения о её качестве до выбора подготовки."
          },
          {
            "title": "Защита компонентов",
            "text": "Фильтрацию подбирают по требованиям оборудования, а не как универсальную опцию."
          },
          {
            "title": "Доступ для ухода",
            "text": "Фильтры, насос и линии располагают так, чтобы регламент можно было реально выполнять."
          }
        ]
      },
      {
        "heading": "Как сценарий влияет на выбор системы",
        "body": "<p>На террасе или летней площадке приоритетом часто становится комфорт людей и контроль попадания влаги на мебель, проходы и отделку. В теплице задача может быть связана с режимом воздуха и растений, но агрономические параметры должен задавать ответственный специалист: монтажная страница не может обещать урожай или универсальную влажность.</p>\n\n<p>Для кафе дополнительно важны зонирование столов, проходы персонала, график работы и быстрое отключение при изменении ветра. На домашней веранде — внешний вид линий, шум оборудования и простое сезонное обслуживание. Поэтому одинаковая площадь не означает одинаковую систему.</p>",
        "points": [
          {
            "title": "Терраса и веранда",
            "text": "Учитывают посадочные места, материалы, ветер, внешний вид линий и доступ владельца к управлению."
          },
          {
            "title": "Кафе и летняя площадка",
            "text": "Проектируют зоны, проходы, режим персонала и возможность отключать отдельные контуры."
          },
          {
            "title": "Теплица и оранжерея",
            "text": "Монтаж связывают с заданным агрономом режимом, вентиляцией и безопасным размещением оборудования."
          }
        ]
      },
      {
        "heading": "Что сравнивать в предложениях",
        "body": "<p>Запрашивайте не только название класса давления. В предложении должны быть понятны обслуживаемые зоны, состав оборудования, требования к воде и электричеству, логика управления, доступ к обслуживанию и границы монтажных работ. Отдельно уточняйте, что произойдёт при ветре и как система выводится из сезонной эксплуатации.</p>\n\n<p>Сравнивайте предложения в одной задаче. Комплект без подготовки воды нельзя честно сопоставить с решением, где фильтрация и обслуживание включены. Также важно отличать поставку оборудования от проектирования, монтажа, настройки и передачи инструкции ответственному пользователю.</p>",
        "points": [
          {
            "title": "Зоны и линии",
            "text": "Где именно пройдут форсунки и можно ли управлять зонами раздельно."
          },
          {
            "title": "Подключения",
            "text": "Какие требования предъявляются к воде, электричеству и месту оборудования."
          },
          {
            "title": "Обслуживание",
            "text": "Какие операции, расходные элементы и сезонные действия понадобятся владельцу."
          },
          {
            "title": "Граница работ",
            "text": "Что относится к поставке, монтажу и настройке, а что должно быть подготовлено на объекте."
          }
        ]
      },
      {
        "heading": "Типичные ошибки выбора и монтажа",
        "body": "<p>Ошибка — выбирать только по максимальному давлению или количеству форсунок. Избыточная линия без правильного зонирования не решает задачу. Не менее проблемно монтировать форсунки без учёта ветра, направлять распыление на скользкие покрытия или закрывать декором доступ к соединениям.</p>\n\n<p>До расчёта подготовьте план зоны, размеры, фотографии конструкций, источник воды и электропитания, режим использования и требования к управлению. Общие варианты собраны на странице <a href=\"https://exp76.ru/services/sistemy-tumanoobrazovaniya/\">систем туманообразования</a>. Для частной открытой зоны используйте отдельную страницу <a href=\"https://exp76.ru/tumanoobrazovanie-dlya-terrasy-i-verandy/\">туманообразования для террасы и веранды</a>.</p>",
        "points": []
      }
    ],
    "blogseo_cta_title": "Нужно сравнить варианты для конкретной площадки?",